[
  {
    "id": "gate_result.template_research_program.public_safety",
    "gate_id": "gate.public_safety",
    "target_id": "package.template_research_program",
    "verdict": "pass",
    "summary": "Template uses synthetic research-program content only.",
    "evidence": ["evidence.synthetic_protocol"],
    "reviewed_at": "2026-06-03",
    "reviewer": "Mirai Graph template validator"
  }
]
